[I 2024-11-08 05:58:21,194] Trial 14 finished with value: 10.0 and parameters: {'abs_or_rel': 'abs', 'loss_type': 'H1', 'n_layers': 13, 'batch_size': 128, 'weight_decay_power': 5, 'lr_val': 8e-05, 'use_embeddings': True, 'embed_d': 22, 'patience': 11}. Best is trial 0 with value: 10.0.
[I 2024-11-08 05:58:56,484] Trial 6 finished with value: 10.0 and parameters: {'abs_or_rel': 'rel', 'loss_type': 'L2', 'n_layers': 10, 'batch_size': 16, 'weight_decay_power': 4, 'lr_val': 0.0005, 'use_embeddings': True, 'embed_d': 6, 'patience': 10}. Best is trial 0 with value: 10.0.
[I 2024-11-08 05:59:11,066] Trial 15 finished with value: 10.0 and parameters: {'abs_or_rel': 'abs', 'loss_type': 'H1', 'n_layers': 14, 'batch_size': 256, 'weight_decay_power': 3, 'lr_val': 0.0004, 'use_embeddings': True, 'embed_d': 14, 'patience': 17}. Best is trial 0 with value: 10.0.
[I 2024-11-08 05:59:31,488] Trial 15 finished with value: 10.0 and parameters: {'abs_or_rel': 'rel', 'loss_type': 'H1', 'n_layers': 11, 'batch_size': 16, 'weight_decay_power': 3, 'lr_val': 0.0005, 'use_embeddings': True, 'embed_d': 10, 'patience': 22}. Best is trial 0 with value: 10.0.
[I 2024-11-08 06:00:12,156] Trial 16 finished with value: 10.0 and parameters: {'abs_or_rel': 'rel', 'loss_type': 'L2', 'n_layers': 16, 'batch_size': 128, 'weight_decay_power': 7, 'lr_val': 0.0003, 'use_embeddings': True, 'embed_d': 10, 'patience': 20}. Best is trial 0 with value: 10.0.
[I 2024-11-08 06:00:18,735] Trial 7 finished with value: 10.0 and parameters: {'abs_or_rel': 'rel', 'loss_type': 'L2', 'n_layers': 9, 'batch_size': 128, 'weight_decay_power': 7, 'lr_val': 0.0001, 'use_embeddings': False, 'patience': 16}. Best is trial 0 with value: 10.0.
[I 2024-11-08 06:00:38,148] Trial 16 finished with value: 10.0 and parameters: {'abs_or_rel': 'rel', 'loss_type': 'H1', 'n_layers': 14, 'batch_size': 64, 'weight_decay_power': 5, 'lr_val': 0.0002, 'use_embeddings': True, 'embed_d': 25, 'patience': 10}. Best is trial 0 with value: 10.0.
[I 2024-11-08 06:00:39,266] Trial 2 finished with value: 10.0 and parameters: {'abs_or_rel': 'abs', 'loss_type': 'L2', 'n_layers': 9, 'batch_size': 256, 'weight_decay_power': 2, 'lr_val': 0.0002, 'use_embeddings': True, 'embed_d': 19, 'patience': 12}. Best is trial 1 with value: 10.0.
[I 2024-11-08 06:01:00,883] Trial 17 finished with value: 10.0 and parameters: {'abs_or_rel': 'abs', 'loss_type': 'H1', 'n_layers': 8, 'batch_size': 32, 'weight_decay_power': 8, 'lr_val': 0.0008, 'use_embeddings': False, 'patience': 22}. Best is trial 0 with value: 10.0.
[I 2024-11-08 06:01:33,088] Trial 17 finished with value: 10.0 and parameters: {'abs_or_rel': 'rel', 'loss_type': 'H1', 'n_layers': 15, 'batch_size': 128, 'weight_decay_power': 6, 'lr_val': 0.0008, 'use_embeddings': False, 'patience': 13}. Best is trial 0 with value: 10.0.
[I 2024-11-08 06:01:54,889] Trial 8 finished with value: 10.0 and parameters: {'abs_or_rel': 'rel', 'loss_type': 'H1', 'n_layers': 8, 'batch_size': 64, 'weight_decay_power': 8, 'lr_val': 0.0002, 'use_embeddings': True, 'embed_d': 30, 'patience': 19}. Best is trial 0 with value: 10.0.
[I 2024-11-08 06:02:41,642] Trial 18 finished with value: 10.0 and parameters: {'abs_or_rel': 'abs', 'loss_type': 'L2', 'n_layers': 12, 'batch_size': 32, 'weight_decay_power': 7, 'lr_val': 0.0006, 'use_embeddings': False, 'patience': 12}. Best is trial 0 with value: 10.0.
[I 2024-11-08 06:02:55,358] Trial 18 finished with value: 10.0 and parameters: {'abs_or_rel': 'abs', 'loss_type': 'H1', 'n_layers': 13, 'batch_size': 16, 'weight_decay_power': 6, 'lr_val': 8e-05, 'use_embeddings': False, 'patience': 14}. Best is trial 0 with value: 10.0.
[I 2024-11-08 06:03:34,774] Trial 19 finished with value: 10.0 and parameters: {'abs_or_rel': 'rel', 'loss_type': 'H1', 'n_layers': 9, 'batch_size': 32, 'weight_decay_power': 4, 'lr_val': 0.0002, 'use_embeddings': False, 'patience': 8}. Best is trial 0 with value: 10.0.
[I 2024-11-08 06:04:09,971] Trial 20 finished with value: 10.0 and parameters: {'abs_or_rel': 'rel', 'loss_type': 'L2', 'n_layers': 10, 'batch_size': 256, 'weight_decay_power': 3, 'lr_val': 0.0006, 'use_embeddings': True, 'embed_d': 3, 'patience': 15}. Best is trial 0 with value: 10.0.
[I 2024-11-08 06:04:25,883] Trial 19 finished with value: 10.0 and parameters: {'abs_or_rel': 'rel', 'loss_type': 'H1', 'n_layers': 10, 'batch_size': 16, 'weight_decay_power': 7, 'lr_val': 0.0002, 'use_embeddings': False, 'patience': 18}. Best is trial 0 with value: 10.0.
[I 2024-11-08 06:04:46,132] Trial 9 finished with value: 10.0 and parameters: {'abs_or_rel': 'abs', 'loss_type': 'L2', 'n_layers': 11, 'batch_size': 32, 'weight_decay_power': 8, 'lr_val': 0.0001, 'use_embeddings': True, 'embed_d': 1, 'patience': 17}. Best is trial 0 with value: 10.0.
[I 2024-11-08 06:04:54,521] Trial 21 finished with value: 10.0 and parameters: {'abs_or_rel': 'abs', 'loss_type': 'L2', 'n_layers': 10, 'batch_size': 64, 'weight_decay_power': 8, 'lr_val': 0.0004, 'use_embeddings': False, 'patience': 13}. Best is trial 0 with value: 10.0.
[I 2024-11-08 06:05:04,079] Trial 20 finished with value: 10.0 and parameters: {'abs_or_rel': 'abs', 'loss_type': 'H1', 'n_layers': 8, 'batch_size': 64, 'weight_decay_power': 2, 'lr_val': 0.0005, 'use_embeddings': True, 'embed_d': 11, 'patience': 23}. Best is trial 0 with value: 10.0.
[I 2024-11-08 06:05:24,085] Trial 22 finished with value: 10.0 and parameters: {'abs_or_rel': 'rel', 'loss_type': 'H1', 'n_layers': 8, 'batch_size': 256, 'weight_decay_power': 6, 'lr_val': 8e-05, 'use_embeddings': True, 'embed_d': 3, 'patience': 15}. Best is trial 0 with value: 10.0.
[I 2024-11-08 06:06:13,117] Trial 23 finished with value: 10.0 and parameters: {'abs_or_rel': 'rel', 'loss_type': 'L2', 'n_layers': 14, 'batch_size': 256, 'weight_decay_power': 6, 'lr_val': 0.0002, 'use_embeddings': True, 'embed_d': 12, 'patience': 24}. Best is trial 0 with value: 10.0.
[I 2024-11-08 06:06:50,052] Trial 21 finished with value: 10.0 and parameters: {'abs_or_rel': 'rel', 'loss_type': 'L2', 'n_layers': 12, 'batch_size': 16, 'weight_decay_power': 7, 'lr_val': 0.0005, 'use_embeddings': False, 'patience': 19}. Best is trial 0 with value: 10.0.
[I 2024-11-08 06:06:59,735] Trial 24 finished with value: 10.0 and parameters: {'abs_or_rel': 'rel', 'loss_type': 'H1', 'n_layers': 10, 'batch_size': 64, 'weight_decay_power': 8, 'lr_val': 0.0005, 'use_embeddings': True, 'embed_d': 3, 'patience': 15}. Best is trial 0 with value: 10.0.
[I 2024-11-08 06:07:09,098] Trial 10 finished with value: 10.0 and parameters: {'abs_or_rel': 'rel', 'loss_type': 'L2', 'n_layers': 13, 'batch_size': 64, 'weight_decay_power': 4, 'lr_val': 0.0007, 'use_embeddings': False, 'patience': 16}. Best is trial 0 with value: 10.0.
[I 2024-11-08 06:08:06,754] Trial 25 finished with value: 10.0 and parameters: {'abs_or_rel': 'abs', 'loss_type': 'H1', 'n_layers': 14, 'batch_size': 64, 'weight_decay_power': 2, 'lr_val': 0.0006, 'use_embeddings': True, 'embed_d': 24, 'patience': 19}. Best is trial 0 with value: 10.0.
[I 2024-11-08 06:08:27,157] Trial 22 finished with value: 10.0 and parameters: {'abs_or_rel': 'rel', 'loss_type': 'L2', 'n_layers': 16, 'batch_size': 32, 'weight_decay_power': 3, 'lr_val': 0.0005, 'use_embeddings': True, 'embed_d': 27, 'patience': 23}. Best is trial 0 with value: 10.0.
[I 2024-11-08 06:08:51,588] Trial 26 finished with value: 10.0 and parameters: {'abs_or_rel': 'rel', 'loss_type': 'L2', 'n_layers': 12, 'batch_size': 256, 'weight_decay_power': 8, 'lr_val': 0.0002, 'use_embeddings': True, 'embed_d': 5, 'patience': 10}. Best is trial 0 with value: 10.0.
[I 2024-11-08 06:09:35,472] Trial 27 finished with value: 10.0 and parameters: {'abs_or_rel': 'abs', 'loss_type': 'H1', 'n_layers': 12, 'batch_size': 256, 'weight_decay_power': 7, 'lr_val': 0.0001, 'use_embeddings': False, 'patience': 23}. Best is trial 0 with value: 10.0.
[I 2024-11-08 06:10:23,183] Trial 28 finished with value: 10.0 and parameters: {'abs_or_rel': 'rel', 'loss_type': 'L2', 'n_layers': 10, 'batch_size': 64, 'weight_decay_power': 3, 'lr_val': 0.0001, 'use_embeddings': False, 'patience': 13}. Best is trial 0 with value: 10.0.
[I 2024-11-08 06:10:32,015] Trial 23 finished with value: 10.0 and parameters: {'abs_or_rel': 'abs', 'loss_type': 'L2', 'n_layers': 14, 'batch_size': 16, 'weight_decay_power': 7, 'lr_val': 8e-05, 'use_embeddings': False, 'patience': 17}. Best is trial 0 with value: 10.0.
[I 2024-11-08 06:11:16,672] Trial 24 finished with value: 10.0 and parameters: {'abs_or_rel': 'abs', 'loss_type': 'L2', 'n_layers': 12, 'batch_size': 128, 'weight_decay_power': 7, 'lr_val': 0.0003, 'use_embeddings': False, 'patience': 8}. Best is trial 0 with value: 10.0.
[I 2024-11-08 06:11:20,971] Trial 29 finished with value: 10.0 and parameters: {'abs_or_rel': 'rel', 'loss_type': 'H1', 'n_layers': 15, 'batch_size': 128, 'weight_decay_power': 6, 'lr_val': 8e-05, 'use_embeddings': True, 'embed_d': 21, 'patience': 18}. Best is trial 0 with value: 10.0.
[I 2024-11-08 06:11:58,593] Trial 25 finished with value: 10.0 and parameters: {'abs_or_rel': 'rel', 'loss_type': 'L2', 'n_layers': 11, 'batch_size': 256, 'weight_decay_power': 2, 'lr_val': 0.0001, 'use_embeddings': True, 'embed_d': 21, 'patience': 15}. Best is trial 0 with value: 10.0.
[I 2024-11-08 06:12:18,537] Trial 30 finished with value: 10.0 and parameters: {'abs_or_rel': 'rel', 'loss_type': 'H1', 'n_layers': 12, 'batch_size': 64, 'weight_decay_power': 2, 'lr_val': 0.0002, 'use_embeddings': True, 'embed_d': 32, 'patience': 20}. Best is trial 0 with value: 10.0.
[I 2024-11-08 06:13:08,953] Trial 26 finished with value: 10.0 and parameters: {'abs_or_rel': 'rel', 'loss_type': 'H1', 'n_layers': 12, 'batch_size': 32, 'weight_decay_power': 2, 'lr_val': 0.0007, 'use_embeddings': True, 'embed_d': 7, 'patience': 23}. Best is trial 0 with value: 10.0.
[I 2024-11-08 06:13:14,166] Trial 31 finished with value: 10.0 and parameters: {'abs_or_rel': 'abs', 'loss_type': 'L2', 'n_layers': 14, 'batch_size': 128, 'weight_decay_power': 4, 'lr_val': 0.0006, 'use_embeddings': True, 'embed_d': 32, 'patience': 18}. Best is trial 0 with value: 10.0.
[I 2024-11-08 06:13:20,198] Trial 11 finished with value: 10.0 and parameters: {'abs_or_rel': 'abs', 'loss_type': 'H1', 'n_layers': 15, 'batch_size': 16, 'weight_decay_power': 4, 'lr_val': 8e-05, 'use_embeddings': True, 'embed_d': 5, 'patience': 19}. Best is trial 0 with value: 10.0.
[I 2024-11-08 06:13:49,147] Trial 27 finished with value: 10.0 and parameters: {'abs_or_rel': 'rel', 'loss_type': 'H1', 'n_layers': 8, 'batch_size': 64, 'weight_decay_power': 7, 'lr_val': 0.0005, 'use_embeddings': True, 'embed_d': 22, 'patience': 20}. Best is trial 0 with value: 10.0.
[I 2024-11-08 06:14:07,825] Trial 32 finished with value: 10.0 and parameters: {'abs_or_rel': 'abs', 'loss_type': 'H1', 'n_layers': 9, 'batch_size': 32, 'weight_decay_power': 7, 'lr_val': 0.0008, 'use_embeddings': False, 'patience': 21}. Best is trial 0 with value: 10.0.
[I 2024-11-08 06:15:04,556] Trial 33 finished with value: 10.0 and parameters: {'abs_or_rel': 'abs', 'loss_type': 'L2', 'n_layers': 13, 'batch_size': 64, 'weight_decay_power': 6, 'lr_val': 0.0002, 'use_embeddings': False, 'patience': 14}. Best is trial 0 with value: 10.0.
[I 2024-11-08 06:15:16,719] Trial 12 finished with value: 10.0 and parameters: {'abs_or_rel': 'abs', 'loss_type': 'H1', 'n_layers': 13, 'batch_size': 128, 'weight_decay_power': 2, 'lr_val': 0.0006, 'use_embeddings': True, 'embed_d': 6, 'patience': 21}. Best is trial 0 with value: 10.0.
[I 2024-11-08 06:15:27,478] Trial 28 finished with value: 10.0 and parameters: {'abs_or_rel': 'abs', 'loss_type': 'L2', 'n_layers': 11, 'batch_size': 16, 'weight_decay_power': 2, 'lr_val': 8e-05, 'use_embeddings': False, 'patience': 22}. Best is trial 0 with value: 10.0.
[I 2024-11-08 06:15:49,763] Trial 34 finished with value: 10.0 and parameters: {'abs_or_rel': 'rel', 'loss_type': 'H1', 'n_layers': 12, 'batch_size': 128, 'weight_decay_power': 5, 'lr_val': 0.0008, 'use_embeddings': False, 'patience': 8}. Best is trial 0 with value: 10.0.
[I 2024-11-08 06:16:17,219] Trial 29 finished with value: 10.0 and parameters: {'abs_or_rel': 'rel', 'loss_type': 'H1', 'n_layers': 13, 'batch_size': 128, 'weight_decay_power': 3, 'lr_val': 0.0002, 'use_embeddings': True, 'embed_d': 9, 'patience': 20}. Best is trial 0 with value: 10.0.
[I 2024-11-08 06:16:40,282] Trial 35 finished with value: 10.0 and parameters: {'abs_or_rel': 'rel', 'loss_type': 'L2', 'n_layers': 15, 'batch_size': 256, 'weight_decay_power': 2, 'lr_val': 0.0006, 'use_embeddings': True, 'embed_d': 1, 'patience': 9}. Best is trial 0 with value: 10.0.
[I 2024-11-08 06:17:03,346] Trial 3 finished with value: 10.0 and parameters: {'abs_or_rel': 'rel', 'loss_type': 'L2', 'n_layers': 8, 'batch_size': 16, 'weight_decay_power': 7, 'lr_val': 0.0006, 'use_embeddings': False, 'patience': 21}. Best is trial 1 with value: 10.0.
[I 2024-11-08 06:17:11,928] Trial 36 finished with value: 10.0 and parameters: {'abs_or_rel': 'abs', 'loss_type': 'H1', 'n_layers': 8, 'batch_size': 128, 'weight_decay_power': 7, 'lr_val': 0.0004, 'use_embeddings': False, 'patience': 22}. Best is trial 0 with value: 10.0.
[I 2024-11-08 06:17:33,416] Trial 30 finished with value: 10.0 and parameters: {'abs_or_rel': 'abs', 'loss_type': 'L2', 'n_layers': 8, 'batch_size': 16, 'weight_decay_power': 6, 'lr_val': 0.0005, 'use_embeddings': True, 'embed_d': 10, 'patience': 10}. Best is trial 0 with value: 10.0.
[I 2024-11-08 06:18:01,869] Trial 37 finished with value: 10.0 and parameters: {'abs_or_rel': 'rel', 'loss_type': 'L2', 'n_layers': 15, 'batch_size': 256, 'weight_decay_power': 8, 'lr_val': 0.0005, 'use_embeddings': False, 'patience': 12}. Best is trial 0 with value: 10.0.
[I 2024-11-08 06:18:08,103] Trial 31 finished with value: 10.0 and parameters: {'abs_or_rel': 'rel', 'loss_type': 'H1', 'n_layers': 10, 'batch_size': 256, 'weight_decay_power': 6, 'lr_val': 0.0001, 'use_embeddings': False, 'patience': 15}. Best is trial 0 with value: 10.0.
[I 2024-11-08 06:18:54,601] Trial 38 finished with value: 10.0 and parameters: {'abs_or_rel': 'abs', 'loss_type': 'H1', 'n_layers': 16, 'batch_size': 256, 'weight_decay_power': 6, 'lr_val': 0.0006, 'use_embeddings': False, 'patience': 12}. Best is trial 0 with value: 10.0.
[I 2024-11-08 06:19:01,670] Trial 32 finished with value: 10.0 and parameters: {'abs_or_rel': 'abs', 'loss_type': 'H1', 'n_layers': 9, 'batch_size': 32, 'weight_decay_power': 6, 'lr_val': 0.0005, 'use_embeddings': False, 'patience': 22}. Best is trial 0 with value: 10.0.
[I 2024-11-08 06:19:32,658] Trial 39 finished with value: 10.0 and parameters: {'abs_or_rel': 'rel', 'loss_type': 'H1', 'n_layers': 11, 'batch_size': 256, 'weight_decay_power': 7, 'lr_val': 8e-05, 'use_embeddings': False, 'patience': 8}. Best is trial 0 with value: 10.0.
[I 2024-11-08 06:19:55,787] Trial 33 finished with value: 10.0 and parameters: {'abs_or_rel': 'abs', 'loss_type': 'L2', 'n_layers': 15, 'batch_size': 256, 'weight_decay_power': 4, 'lr_val': 0.0001, 'use_embeddings': True, 'embed_d': 31, 'patience': 14}. Best is trial 0 with value: 10.0.
[I 2024-11-08 06:21:09,544] Trial 34 finished with value: 10.0 and parameters: {'abs_or_rel': 'rel', 'loss_type': 'H1', 'n_layers': 13, 'batch_size': 32, 'weight_decay_power': 8, 'lr_val': 0.0001, 'use_embeddings': False, 'patience': 14}. Best is trial 0 with value: 10.0.
[I 2024-11-08 06:21:21,182] Trial 40 finished with value: 10.0 and parameters: {'abs_or_rel': 'rel', 'loss_type': 'H1', 'n_layers': 12, 'batch_size': 16, 'weight_decay_power': 2, 'lr_val': 8e-05, 'use_embeddings': True, 'embed_d': 11, 'patience': 10}. Best is trial 0 with value: 10.0.
[I 2024-11-08 06:21:46,137] Trial 13 finished with value: 10.0 and parameters: {'abs_or_rel': 'abs', 'loss_type': 'L2', 'n_layers': 16, 'batch_size': 16, 'weight_decay_power': 4, 'lr_val': 0.0008, 'use_embeddings': False, 'patience': 21}. Best is trial 0 with value: 10.0.
[I 2024-11-08 06:22:04,265] Trial 41 finished with value: 10.0 and parameters: {'abs_or_rel': 'rel', 'loss_type': 'H1', 'n_layers': 12, 'batch_size': 256, 'weight_decay_power': 6, 'lr_val': 0.0005, 'use_embeddings': True, 'embed_d': 13, 'patience': 9}. Best is trial 0 with value: 10.0.
[I 2024-11-08 06:23:17,515] Trial 42 finished with value: 10.0 and parameters: {'abs_or_rel': 'abs', 'loss_type': 'L2', 'n_layers': 8, 'batch_size': 16, 'weight_decay_power': 7, 'lr_val': 0.0001, 'use_embeddings': False, 'patience': 8}. Best is trial 0 with value: 10.0.
[I 2024-11-08 06:23:27,141] Trial 35 finished with value: 10.0 and parameters: {'abs_or_rel': 'abs', 'loss_type': 'H1', 'n_layers': 16, 'batch_size': 16, 'weight_decay_power': 3, 'lr_val': 0.0002, 'use_embeddings': False, 'patience': 8}. Best is trial 0 with value: 10.0.
[I 2024-11-08 06:24:17,110] Trial 36 finished with value: 10.0 and parameters: {'abs_or_rel': 'abs', 'loss_type': 'H1', 'n_layers': 13, 'batch_size': 128, 'weight_decay_power': 4, 'lr_val': 0.0001, 'use_embeddings': True, 'embed_d': 17, 'patience': 16}. Best is trial 0 with value: 10.0.
[I 2024-11-08 06:24:25,029] Trial 43 finished with value: 10.0 and parameters: {'abs_or_rel': 'rel', 'loss_type': 'L2', 'n_layers': 16, 'batch_size': 64, 'weight_decay_power': 7, 'lr_val': 0.0003, 'use_embeddings': False, 'patience': 22}. Best is trial 0 with value: 10.0.
[I 2024-11-08 06:25:03,174] Trial 44 finished with value: 10.0 and parameters: {'abs_or_rel': 'rel', 'loss_type': 'H1', 'n_layers': 8, 'batch_size': 64, 'weight_decay_power': 8, 'lr_val': 0.0001, 'use_embeddings': True, 'embed_d': 11, 'patience': 13}. Best is trial 0 with value: 10.0.
[I 2024-11-08 06:25:59,273] Trial 37 finished with value: 10.0 and parameters: {'abs_or_rel': 'abs', 'loss_type': 'L2', 'n_layers': 11, 'batch_size': 16, 'weight_decay_power': 6, 'lr_val': 0.0005, 'use_embeddings': True, 'embed_d': 29, 'patience': 21}. Best is trial 0 with value: 10.0.
[I 2024-11-08 06:26:19,260] Trial 45 finished with value: 10.0 and parameters: {'abs_or_rel': 'abs', 'loss_type': 'L2', 'n_layers': 8, 'batch_size': 16, 'weight_decay_power': 6, 'lr_val': 0.0006, 'use_embeddings': True, 'embed_d': 8, 'patience': 12}. Best is trial 0 with value: 10.0.
[I 2024-11-08 06:26:34,035] Trial 38 finished with value: 10.0 and parameters: {'abs_or_rel': 'abs', 'loss_type': 'L2', 'n_layers': 10, 'batch_size': 256, 'weight_decay_power': 2, 'lr_val': 0.0001, 'use_embeddings': False, 'patience': 21}. Best is trial 0 with value: 10.0.
[I 2024-11-08 06:27:04,933] Trial 14 finished with value: 10.0 and parameters: {'abs_or_rel': 'abs', 'loss_type': 'H1', 'n_layers': 13, 'batch_size': 16, 'weight_decay_power': 6, 'lr_val': 8e-05, 'use_embeddings': False, 'patience': 9}. Best is trial 0 with value: 10.0.
[I 2024-11-08 06:27:17,389] Trial 46 finished with value: 10.0 and parameters: {'abs_or_rel': 'rel', 'loss_type': 'H1', 'n_layers': 16, 'batch_size': 128, 'weight_decay_power': 6, 'lr_val': 0.0008, 'use_embeddings': False, 'patience': 12}. Best is trial 0 with value: 10.0.
[I 2024-11-08 06:28:06,151] Trial 47 finished with value: 10.0 and parameters: {'abs_or_rel': 'abs', 'loss_type': 'L2', 'n_layers': 13, 'batch_size': 128, 'weight_decay_power': 2, 'lr_val': 0.0003, 'use_embeddings': True, 'embed_d': 8, 'patience': 18}. Best is trial 0 with value: 10.0.
[I 2024-11-08 06:28:35,419] Trial 39 finished with value: 10.0 and parameters: {'abs_or_rel': 'abs', 'loss_type': 'L2', 'n_layers': 14, 'batch_size': 16, 'weight_decay_power': 7, 'lr_val': 0.0006, 'use_embeddings': False, 'patience': 12}. Best is trial 0 with value: 10.0.
[I 2024-11-08 06:28:50,381] Trial 48 finished with value: 10.0 and parameters: {'abs_or_rel': 'rel', 'loss_type': 'L2', 'n_layers': 12, 'batch_size': 128, 'weight_decay_power': 3, 'lr_val': 0.0005, 'use_embeddings': False, 'patience': 17}. Best is trial 0 with value: 10.0.
[I 2024-11-08 06:29:26,003] Trial 40 finished with value: 10.0 and parameters: {'abs_or_rel': 'rel', 'loss_type': 'L2', 'n_layers': 14, 'batch_size': 128, 'weight_decay_power': 7, 'lr_val': 0.0006, 'use_embeddings': False, 'patience': 24}. Best is trial 0 with value: 10.0.
[I 2024-11-08 06:30:16,892] Trial 49 finished with value: 10.0 and parameters: {'abs_or_rel': 'rel', 'loss_type': 'H1', 'n_layers': 9, 'batch_size': 16, 'weight_decay_power': 6, 'lr_val': 0.0002, 'use_embeddings': True, 'embed_d': 19, 'patience': 10}. Best is trial 0 with value: 10.0.

Best value: 10.0 (params: {'abs_or_rel': 'rel', 'loss_type': 'H1', 'n_layers': 15, 'batch_size': 16, 'weight_decay_power': 7, 'lr_val': 0.0005, 'use_embeddings': False, 'patience': 18})
[I 2024-11-08 06:31:25,378] Trial 41 finished with value: 10.0 and parameters: {'abs_or_rel': 'rel', 'loss_type': 'H1', 'n_layers': 13, 'batch_size': 16, 'weight_decay_power': 8, 'lr_val': 0.0002, 'use_embeddings': True, 'embed_d': 32, 'patience': 15}. Best is trial 0 with value: 10.0.
[I 2024-11-08 06:32:50,052] Trial 15 finished with value: 10.0 and parameters: {'abs_or_rel': 'abs', 'loss_type': 'L2', 'n_layers': 14, 'batch_size': 16, 'weight_decay_power': 6, 'lr_val': 0.0005, 'use_embeddings': True, 'embed_d': 19, 'patience': 9}. Best is trial 0 with value: 10.0.
[I 2024-11-08 06:32:52,700] Trial 42 finished with value: 10.0 and parameters: {'abs_or_rel': 'rel', 'loss_type': 'H1', 'n_layers': 15, 'batch_size': 32, 'weight_decay_power': 7, 'lr_val': 0.0002, 'use_embeddings': True, 'embed_d': 21, 'patience': 15}. Best is trial 0 with value: 10.0.
[I 2024-11-08 06:34:12,528] Trial 43 finished with value: 10.0 and parameters: {'abs_or_rel': 'rel', 'loss_type': 'L2', 'n_layers': 14, 'batch_size': 32, 'weight_decay_power': 8, 'lr_val': 0.0006, 'use_embeddings': True, 'embed_d': 8, 'patience': 23}. Best is trial 0 with value: 10.0.
