[I 2024-11-08 05:42:02,884] A new study created in RDB with name: Robert_Truncated_New_10000
[I 2024-11-08 05:42:02,922] A new study created in RDB with name: Robert_Truncated_New_biggerproj
[I 2024-11-08 05:42:03,020] A new study created in RDB with name: Robert_Truncated_New_2000
[I 2024-11-08 05:42:03,051] Using an existing study with name 'Robert_Truncated_New' instead of creating a new one.
/global/u1/r/rgeorge/repo/neuraloperator/examples/Optuna_Training3.py:59: DeprecationWarning: __array_wrap__ must accept context and return_scalar arguments (positionally) in the future. (Deprecated NumPy 2.0)
  input_data[:, 3+6*i, :] = poling_region_length.repeat(num,1).permute(1,0)  * np.cos((i+1)*t).repeat(samples,1)
/global/u1/r/rgeorge/repo/neuraloperator/examples/Optuna_Training3.py:60: DeprecationWarning: __array_wrap__ must accept context and return_scalar arguments (positionally) in the future. (Deprecated NumPy 2.0)
  input_data[:, 4+6*i, :] = poling_region_length.repeat(num,1).permute(1,0)  * np.sin((i+1)*t).repeat(samples,1)
/global/u1/r/rgeorge/repo/neuraloperator/examples/Optuna_Training3.py:61: DeprecationWarning: __array_wrap__ must accept context and return_scalar arguments (positionally) in the future. (Deprecated NumPy 2.0)
  input_data[:, 5+6*i, :] = poling_period_mismatch.repeat(num,1).permute(1,0) * np.cos((i+1)*t).repeat(samples,1)
/global/u1/r/rgeorge/repo/neuraloperator/examples/Optuna_Training3.py:62: DeprecationWarning: __array_wrap__ must accept context and return_scalar arguments (positionally) in the future. (Deprecated NumPy 2.0)
  input_data[:, 6+6*i, :] = poling_period_mismatch.repeat(num,1).permute(1,0) * np.sin((i+1)*t).repeat(samples,1)
/global/u1/r/rgeorge/repo/neuraloperator/examples/Optuna_Training3.py:63: DeprecationWarning: __array_wrap__ must accept context and return_scalar arguments (positionally) in the future. (Deprecated NumPy 2.0)
  input_data[:, 7+6*i, :] = pump_energy.repeat(num,1).permute(1,0) * np.cos((i+1)*t).repeat(samples,1)
/global/u1/r/rgeorge/repo/neuraloperator/examples/Optuna_Training3.py:64: DeprecationWarning: __array_wrap__ must accept context and return_scalar arguments (positionally) in the future. (Deprecated NumPy 2.0)
  input_data[:, 8+6*i, :] = pump_energy.repeat(num,1).permute(1,0) * np.sin((i+1)*t).repeat(samples,1)
/global/u1/r/rgeorge/repo/neuraloperator/examples/Optuna_Training1.py:59: DeprecationWarning: __array_wrap__ must accept context and return_scalar arguments (positionally) in the future. (Deprecated NumPy 2.0)
  input_data[:, 3+6*i, :] = poling_region_length.repeat(num,1).permute(1,0)  * np.cos((i+1)*t).repeat(samples,1)
/global/u1/r/rgeorge/repo/neuraloperator/examples/Optuna_Training1.py:60: DeprecationWarning: __array_wrap__ must accept context and return_scalar arguments (positionally) in the future. (Deprecated NumPy 2.0)
  input_data[:, 4+6*i, :] = poling_region_length.repeat(num,1).permute(1,0)  * np.sin((i+1)*t).repeat(samples,1)
/global/u1/r/rgeorge/repo/neuraloperator/examples/Optuna_Training1.py:61: DeprecationWarning: __array_wrap__ must accept context and return_scalar arguments (positionally) in the future. (Deprecated NumPy 2.0)
  input_data[:, 5+6*i, :] = poling_period_mismatch.repeat(num,1).permute(1,0) * np.cos((i+1)*t).repeat(samples,1)
/global/u1/r/rgeorge/repo/neuraloperator/examples/Optuna_Training1.py:62: DeprecationWarning: __array_wrap__ must accept context and return_scalar arguments (positionally) in the future. (Deprecated NumPy 2.0)
  input_data[:, 6+6*i, :] = poling_period_mismatch.repeat(num,1).permute(1,0) * np.sin((i+1)*t).repeat(samples,1)
/global/u1/r/rgeorge/repo/neuraloperator/examples/Optuna_Training1.py:63: DeprecationWarning: __array_wrap__ must accept context and return_scalar arguments (positionally) in the future. (Deprecated NumPy 2.0)
  input_data[:, 7+6*i, :] = pump_energy.repeat(num,1).permute(1,0) * np.cos((i+1)*t).repeat(samples,1)
/global/u1/r/rgeorge/repo/neuraloperator/examples/Optuna_Training1.py:64: DeprecationWarning: __array_wrap__ must accept context and return_scalar arguments (positionally) in the future. (Deprecated NumPy 2.0)
  input_data[:, 8+6*i, :] = pump_energy.repeat(num,1).permute(1,0) * np.sin((i+1)*t).repeat(samples,1)
[I 2024-11-08 05:42:53,576] Trial 0 finished with value: 10.0 and parameters: {'abs_or_rel': 'rel', 'loss_type': 'L2', 'n_layers': 10, 'batch_size': 64, 'weight_decay_power': 7, 'lr_val': 0.0004, 'use_embeddings': True, 'embed_d': 2, 'patience': 11}. Best is trial 0 with value: 10.0.
/global/u1/r/rgeorge/repo/neuraloperator/examples/Optuna_Training1.py:59: DeprecationWarning: __array_wrap__ must accept context and return_scalar arguments (positionally) in the future. (Deprecated NumPy 2.0)
  input_data[:, 3+6*i, :] = poling_region_length.repeat(num,1).permute(1,0)  * np.cos((i+1)*t).repeat(samples,1)
/global/u1/r/rgeorge/repo/neuraloperator/examples/Optuna_Training1.py:60: DeprecationWarning: __array_wrap__ must accept context and return_scalar arguments (positionally) in the future. (Deprecated NumPy 2.0)
  input_data[:, 4+6*i, :] = poling_region_length.repeat(num,1).permute(1,0)  * np.sin((i+1)*t).repeat(samples,1)
/global/u1/r/rgeorge/repo/neuraloperator/examples/Optuna_Training1.py:61: DeprecationWarning: __array_wrap__ must accept context and return_scalar arguments (positionally) in the future. (Deprecated NumPy 2.0)
  input_data[:, 5+6*i, :] = poling_period_mismatch.repeat(num,1).permute(1,0) * np.cos((i+1)*t).repeat(samples,1)
/global/u1/r/rgeorge/repo/neuraloperator/examples/Optuna_Training1.py:62: DeprecationWarning: __array_wrap__ must accept context and return_scalar arguments (positionally) in the future. (Deprecated NumPy 2.0)
  input_data[:, 6+6*i, :] = poling_period_mismatch.repeat(num,1).permute(1,0) * np.sin((i+1)*t).repeat(samples,1)
/global/u1/r/rgeorge/repo/neuraloperator/examples/Optuna_Training1.py:63: DeprecationWarning: __array_wrap__ must accept context and return_scalar arguments (positionally) in the future. (Deprecated NumPy 2.0)
  input_data[:, 7+6*i, :] = pump_energy.repeat(num,1).permute(1,0) * np.cos((i+1)*t).repeat(samples,1)
/global/u1/r/rgeorge/repo/neuraloperator/examples/Optuna_Training1.py:64: DeprecationWarning: __array_wrap__ must accept context and return_scalar arguments (positionally) in the future. (Deprecated NumPy 2.0)
  input_data[:, 8+6*i, :] = pump_energy.repeat(num,1).permute(1,0) * np.sin((i+1)*t).repeat(samples,1)
[I 2024-11-08 05:44:14,111] Trial 0 finished with value: 10.0 and parameters: {'abs_or_rel': 'rel', 'loss_type': 'H1', 'n_layers': 8, 'batch_size': 32, 'weight_decay_power': 6, 'lr_val': 0.0007, 'use_embeddings': False, 'patience': 24}. Best is trial 0 with value: 10.0.
[I 2024-11-08 05:44:19,072] Trial 0 finished with value: 10.0 and parameters: {'abs_or_rel': 'rel', 'loss_type': 'H1', 'n_layers': 15, 'batch_size': 16, 'weight_decay_power': 7, 'lr_val': 0.0005, 'use_embeddings': False, 'patience': 18}. Best is trial 0 with value: 10.0.
[I 2024-11-08 05:44:43,682] Trial 1 finished with value: 10.0 and parameters: {'abs_or_rel': 'rel', 'loss_type': 'L2', 'n_layers': 12, 'batch_size': 16, 'weight_decay_power': 8, 'lr_val': 0.0002, 'use_embeddings': True, 'embed_d': 24, 'patience': 13}. Best is trial 0 with value: 10.0.
[I 2024-11-08 05:45:12,498] Trial 1 finished with value: 10.0 and parameters: {'abs_or_rel': 'abs', 'loss_type': 'H1', 'n_layers': 16, 'batch_size': 256, 'weight_decay_power': 7, 'lr_val': 0.0008, 'use_embeddings': False, 'patience': 16}. Best is trial 0 with value: 10.0.
/global/u1/r/rgeorge/repo/neuraloperator/examples/Optuna_Training.py:59: DeprecationWarning: __array_wrap__ must accept context and return_scalar arguments (positionally) in the future. (Deprecated NumPy 2.0)
  input_data[:, 3+6*i, :] = poling_region_length.repeat(num,1).permute(1,0)  * np.cos((i+1)*t).repeat(samples,1)
/global/u1/r/rgeorge/repo/neuraloperator/examples/Optuna_Training.py:60: DeprecationWarning: __array_wrap__ must accept context and return_scalar arguments (positionally) in the future. (Deprecated NumPy 2.0)
  input_data[:, 4+6*i, :] = poling_region_length.repeat(num,1).permute(1,0)  * np.sin((i+1)*t).repeat(samples,1)
/global/u1/r/rgeorge/repo/neuraloperator/examples/Optuna_Training.py:61: DeprecationWarning: __array_wrap__ must accept context and return_scalar arguments (positionally) in the future. (Deprecated NumPy 2.0)
  input_data[:, 5+6*i, :] = poling_period_mismatch.repeat(num,1).permute(1,0) * np.cos((i+1)*t).repeat(samples,1)
/global/u1/r/rgeorge/repo/neuraloperator/examples/Optuna_Training.py:62: DeprecationWarning: __array_wrap__ must accept context and return_scalar arguments (positionally) in the future. (Deprecated NumPy 2.0)
  input_data[:, 6+6*i, :] = poling_period_mismatch.repeat(num,1).permute(1,0) * np.sin((i+1)*t).repeat(samples,1)
/global/u1/r/rgeorge/repo/neuraloperator/examples/Optuna_Training.py:63: DeprecationWarning: __array_wrap__ must accept context and return_scalar arguments (positionally) in the future. (Deprecated NumPy 2.0)
  input_data[:, 7+6*i, :] = pump_energy.repeat(num,1).permute(1,0) * np.cos((i+1)*t).repeat(samples,1)
/global/u1/r/rgeorge/repo/neuraloperator/examples/Optuna_Training.py:64: DeprecationWarning: __array_wrap__ must accept context and return_scalar arguments (positionally) in the future. (Deprecated NumPy 2.0)
  input_data[:, 8+6*i, :] = pump_energy.repeat(num,1).permute(1,0) * np.sin((i+1)*t).repeat(samples,1)
[I 2024-11-08 05:45:53,782] Trial 2 finished with value: 10.0 and parameters: {'abs_or_rel': 'rel', 'loss_type': 'L2', 'n_layers': 11, 'batch_size': 128, 'weight_decay_power': 7, 'lr_val': 0.0007, 'use_embeddings': True, 'embed_d': 4, 'patience': 22}. Best is trial 0 with value: 10.0.
[I 2024-11-08 05:46:02,897] Trial 2 finished with value: 10.0 and parameters: {'abs_or_rel': 'rel', 'loss_type': 'L2', 'n_layers': 14, 'batch_size': 32, 'weight_decay_power': 3, 'lr_val': 0.0001, 'use_embeddings': False, 'patience': 22}. Best is trial 0 with value: 10.0.
[I 2024-11-08 05:46:43,367] Trial 3 finished with value: 10.0 and parameters: {'abs_or_rel': 'abs', 'loss_type': 'L2', 'n_layers': 15, 'batch_size': 256, 'weight_decay_power': 7, 'lr_val': 0.0008, 'use_embeddings': False, 'patience': 12}. Best is trial 0 with value: 10.0.
[I 2024-11-08 05:46:50,108] Trial 1 finished with value: 10.0 and parameters: {'abs_or_rel': 'abs', 'loss_type': 'L2', 'n_layers': 10, 'batch_size': 32, 'weight_decay_power': 4, 'lr_val': 0.0008, 'use_embeddings': False, 'patience': 10}. Best is trial 0 with value: 10.0.
/global/u1/r/rgeorge/repo/neuraloperator/examples/Optuna_Training2.py:59: DeprecationWarning: __array_wrap__ must accept context and return_scalar arguments (positionally) in the future. (Deprecated NumPy 2.0)
  input_data[:, 3+6*i, :] = poling_region_length.repeat(num,1).permute(1,0)  * np.cos((i+1)*t).repeat(samples,1)
/global/u1/r/rgeorge/repo/neuraloperator/examples/Optuna_Training2.py:60: DeprecationWarning: __array_wrap__ must accept context and return_scalar arguments (positionally) in the future. (Deprecated NumPy 2.0)
  input_data[:, 4+6*i, :] = poling_region_length.repeat(num,1).permute(1,0)  * np.sin((i+1)*t).repeat(samples,1)
/global/u1/r/rgeorge/repo/neuraloperator/examples/Optuna_Training2.py:61: DeprecationWarning: __array_wrap__ must accept context and return_scalar arguments (positionally) in the future. (Deprecated NumPy 2.0)
  input_data[:, 5+6*i, :] = poling_period_mismatch.repeat(num,1).permute(1,0) * np.cos((i+1)*t).repeat(samples,1)
/global/u1/r/rgeorge/repo/neuraloperator/examples/Optuna_Training2.py:62: DeprecationWarning: __array_wrap__ must accept context and return_scalar arguments (positionally) in the future. (Deprecated NumPy 2.0)
  input_data[:, 6+6*i, :] = poling_period_mismatch.repeat(num,1).permute(1,0) * np.sin((i+1)*t).repeat(samples,1)
/global/u1/r/rgeorge/repo/neuraloperator/examples/Optuna_Training2.py:63: DeprecationWarning: __array_wrap__ must accept context and return_scalar arguments (positionally) in the future. (Deprecated NumPy 2.0)
  input_data[:, 7+6*i, :] = pump_energy.repeat(num,1).permute(1,0) * np.cos((i+1)*t).repeat(samples,1)
/global/u1/r/rgeorge/repo/neuraloperator/examples/Optuna_Training2.py:64: DeprecationWarning: __array_wrap__ must accept context and return_scalar arguments (positionally) in the future. (Deprecated NumPy 2.0)
  input_data[:, 8+6*i, :] = pump_energy.repeat(num,1).permute(1,0) * np.sin((i+1)*t).repeat(samples,1)
[I 2024-11-08 05:46:50,977] Trial 3 finished with value: 10.0 and parameters: {'abs_or_rel': 'abs', 'loss_type': 'L2', 'n_layers': 8, 'batch_size': 32, 'weight_decay_power': 3, 'lr_val': 0.0005, 'use_embeddings': False, 'patience': 18}. Best is trial 0 with value: 10.0.
[I 2024-11-08 05:47:22,771] Trial 4 finished with value: 10.0 and parameters: {'abs_or_rel': 'abs', 'loss_type': 'L2', 'n_layers': 8, 'batch_size': 128, 'weight_decay_power': 6, 'lr_val': 0.0007, 'use_embeddings': True, 'embed_d': 6, 'patience': 22}. Best is trial 0 with value: 10.0.
[I 2024-11-08 05:47:42,266] Trial 4 finished with value: 10.0 and parameters: {'abs_or_rel': 'abs', 'loss_type': 'L2', 'n_layers': 10, 'batch_size': 32, 'weight_decay_power': 6, 'lr_val': 0.0002, 'use_embeddings': False, 'patience': 16}. Best is trial 0 with value: 10.0.
[I 2024-11-08 05:48:12,698] Trial 5 finished with value: 10.0 and parameters: {'abs_or_rel': 'abs', 'loss_type': 'H1', 'n_layers': 11, 'batch_size': 64, 'weight_decay_power': 3, 'lr_val': 0.0008, 'use_embeddings': False, 'patience': 15}. Best is trial 0 with value: 10.0.
[I 2024-11-08 05:49:02,222] Trial 5 finished with value: 10.0 and parameters: {'abs_or_rel': 'abs', 'loss_type': 'H1', 'n_layers': 14, 'batch_size': 32, 'weight_decay_power': 6, 'lr_val': 0.0006, 'use_embeddings': False, 'patience': 20}. Best is trial 0 with value: 10.0.
[I 2024-11-08 05:49:27,684] Trial 6 finished with value: 10.0 and parameters: {'abs_or_rel': 'abs', 'loss_type': 'L2', 'n_layers': 8, 'batch_size': 16, 'weight_decay_power': 7, 'lr_val': 0.0003, 'use_embeddings': False, 'patience': 14}. Best is trial 0 with value: 10.0.
[I 2024-11-08 05:49:53,863] Trial 6 finished with value: 10.0 and parameters: {'abs_or_rel': 'rel', 'loss_type': 'L2', 'n_layers': 12, 'batch_size': 128, 'weight_decay_power': 2, 'lr_val': 0.0002, 'use_embeddings': True, 'embed_d': 26, 'patience': 17}. Best is trial 0 with value: 10.0.
[I 2024-11-08 05:50:03,897] Trial 7 finished with value: 10.0 and parameters: {'abs_or_rel': 'abs', 'loss_type': 'L2', 'n_layers': 8, 'batch_size': 128, 'weight_decay_power': 4, 'lr_val': 8e-05, 'use_embeddings': True, 'embed_d': 12, 'patience': 17}. Best is trial 0 with value: 10.0.
[I 2024-11-08 05:50:16,451] Trial 2 finished with value: 10.0 and parameters: {'abs_or_rel': 'abs', 'loss_type': 'H1', 'n_layers': 8, 'batch_size': 16, 'weight_decay_power': 8, 'lr_val': 0.0003, 'use_embeddings': True, 'embed_d': 19, 'patience': 17}. Best is trial 0 with value: 10.0.
[I 2024-11-08 05:50:45,046] Trial 7 finished with value: 10.0 and parameters: {'abs_or_rel': 'abs', 'loss_type': 'L2', 'n_layers': 14, 'batch_size': 128, 'weight_decay_power': 3, 'lr_val': 0.0008, 'use_embeddings': False, 'patience': 10}. Best is trial 0 with value: 10.0.
[I 2024-11-08 05:51:03,748] Trial 8 finished with value: 10.0 and parameters: {'abs_or_rel': 'rel', 'loss_type': 'H1', 'n_layers': 14, 'batch_size': 64, 'weight_decay_power': 2, 'lr_val': 0.0001, 'use_embeddings': False, 'patience': 24}. Best is trial 0 with value: 10.0.
[I 2024-11-08 05:51:26,786] Trial 8 finished with value: 10.0 and parameters: {'abs_or_rel': 'rel', 'loss_type': 'L2', 'n_layers': 12, 'batch_size': 256, 'weight_decay_power': 8, 'lr_val': 0.0006, 'use_embeddings': True, 'embed_d': 7, 'patience': 11}. Best is trial 0 with value: 10.0.
[I 2024-11-08 05:51:29,630] Trial 3 finished with value: 10.0 and parameters: {'abs_or_rel': 'abs', 'loss_type': 'L2', 'n_layers': 8, 'batch_size': 128, 'weight_decay_power': 8, 'lr_val': 0.0003, 'use_embeddings': False, 'patience': 21}. Best is trial 0 with value: 10.0.
[I 2024-11-08 05:52:22,472] Trial 9 finished with value: 10.0 and parameters: {'abs_or_rel': 'rel', 'loss_type': 'L2', 'n_layers': 12, 'batch_size': 64, 'weight_decay_power': 5, 'lr_val': 0.0003, 'use_embeddings': True, 'embed_d': 21, 'patience': 24}. Best is trial 0 with value: 10.0.
[I 2024-11-08 05:52:26,114] Trial 9 finished with value: 10.0 and parameters: {'abs_or_rel': 'rel', 'loss_type': 'L2', 'n_layers': 14, 'batch_size': 32, 'weight_decay_power': 7, 'lr_val': 0.0002, 'use_embeddings': True, 'embed_d': 26, 'patience': 16}. Best is trial 0 with value: 10.0.
[I 2024-11-08 05:52:34,504] Trial 4 finished with value: 10.0 and parameters: {'abs_or_rel': 'abs', 'loss_type': 'H1', 'n_layers': 8, 'batch_size': 256, 'weight_decay_power': 8, 'lr_val': 0.0008, 'use_embeddings': False, 'patience': 24}. Best is trial 0 with value: 10.0.
[I 2024-11-08 05:53:06,694] Trial 10 finished with value: 10.0 and parameters: {'abs_or_rel': 'rel', 'loss_type': 'L2', 'n_layers': 12, 'batch_size': 256, 'weight_decay_power': 4, 'lr_val': 0.0007, 'use_embeddings': False, 'patience': 14}. Best is trial 0 with value: 10.0.
[I 2024-11-08 05:53:44,448] Trial 10 finished with value: 10.0 and parameters: {'abs_or_rel': 'abs', 'loss_type': 'L2', 'n_layers': 14, 'batch_size': 32, 'weight_decay_power': 3, 'lr_val': 0.0008, 'use_embeddings': True, 'embed_d': 21, 'patience': 13}. Best is trial 0 with value: 10.0.
[I 2024-11-08 05:54:32,056] Trial 11 finished with value: 10.0 and parameters: {'abs_or_rel': 'rel', 'loss_type': 'H1', 'n_layers': 13, 'batch_size': 128, 'weight_decay_power': 2, 'lr_val': 0.0001, 'use_embeddings': True, 'embed_d': 1, 'patience': 23}. Best is trial 0 with value: 10.0.
[I 2024-11-08 05:54:33,507] Trial 11 finished with value: 10.0 and parameters: {'abs_or_rel': 'rel', 'loss_type': 'H1', 'n_layers': 9, 'batch_size': 16, 'weight_decay_power': 2, 'lr_val': 0.0008, 'use_embeddings': True, 'embed_d': 20, 'patience': 18}. Best is trial 0 with value: 10.0.
[I 2024-11-08 05:54:45,783] Trial 1 finished with value: 10.0 and parameters: {'abs_or_rel': 'rel', 'loss_type': 'H1', 'n_layers': 14, 'batch_size': 64, 'weight_decay_power': 5, 'lr_val': 0.0007, 'use_embeddings': True, 'embed_d': 27, 'patience': 14}. Best is trial 1 with value: 10.0.
[I 2024-11-08 05:54:46,748] Trial 5 finished with value: 10.0 and parameters: {'abs_or_rel': 'abs', 'loss_type': 'H1', 'n_layers': 12, 'batch_size': 64, 'weight_decay_power': 6, 'lr_val': 8e-05, 'use_embeddings': False, 'patience': 13}. Best is trial 0 with value: 10.0.
/global/u1/r/rgeorge/repo/neuraloperator/examples/Optuna_Training3.py:59: DeprecationWarning: __array_wrap__ must accept context and return_scalar arguments (positionally) in the future. (Deprecated NumPy 2.0)
  input_data[:, 3+6*i, :] = poling_region_length.repeat(num,1).permute(1,0)  * np.cos((i+1)*t).repeat(samples,1)
/global/u1/r/rgeorge/repo/neuraloperator/examples/Optuna_Training3.py:60: DeprecationWarning: __array_wrap__ must accept context and return_scalar arguments (positionally) in the future. (Deprecated NumPy 2.0)
  input_data[:, 4+6*i, :] = poling_region_length.repeat(num,1).permute(1,0)  * np.sin((i+1)*t).repeat(samples,1)
/global/u1/r/rgeorge/repo/neuraloperator/examples/Optuna_Training3.py:61: DeprecationWarning: __array_wrap__ must accept context and return_scalar arguments (positionally) in the future. (Deprecated NumPy 2.0)
  input_data[:, 5+6*i, :] = poling_period_mismatch.repeat(num,1).permute(1,0) * np.cos((i+1)*t).repeat(samples,1)
/global/u1/r/rgeorge/repo/neuraloperator/examples/Optuna_Training3.py:62: DeprecationWarning: __array_wrap__ must accept context and return_scalar arguments (positionally) in the future. (Deprecated NumPy 2.0)
  input_data[:, 6+6*i, :] = poling_period_mismatch.repeat(num,1).permute(1,0) * np.sin((i+1)*t).repeat(samples,1)
/global/u1/r/rgeorge/repo/neuraloperator/examples/Optuna_Training3.py:63: DeprecationWarning: __array_wrap__ must accept context and return_scalar arguments (positionally) in the future. (Deprecated NumPy 2.0)
  input_data[:, 7+6*i, :] = pump_energy.repeat(num,1).permute(1,0) * np.cos((i+1)*t).repeat(samples,1)
/global/u1/r/rgeorge/repo/neuraloperator/examples/Optuna_Training3.py:64: DeprecationWarning: __array_wrap__ must accept context and return_scalar arguments (positionally) in the future. (Deprecated NumPy 2.0)
  input_data[:, 8+6*i, :] = pump_energy.repeat(num,1).permute(1,0) * np.sin((i+1)*t).repeat(samples,1)
[I 2024-11-08 05:55:19,025] Trial 12 finished with value: 10.0 and parameters: {'abs_or_rel': 'rel', 'loss_type': 'L2', 'n_layers': 13, 'batch_size': 256, 'weight_decay_power': 8, 'lr_val': 0.0001, 'use_embeddings': True, 'embed_d': 13, 'patience': 24}. Best is trial 0 with value: 10.0.
[I 2024-11-08 05:56:05,071] Trial 12 finished with value: 10.0 and parameters: {'abs_or_rel': 'abs', 'loss_type': 'H1', 'n_layers': 10, 'batch_size': 16, 'weight_decay_power': 6, 'lr_val': 8e-05, 'use_embeddings': True, 'embed_d': 7, 'patience': 21}. Best is trial 0 with value: 10.0.
[I 2024-11-08 05:56:41,290] Trial 13 finished with value: 10.0 and parameters: {'abs_or_rel': 'rel', 'loss_type': 'H1', 'n_layers': 9, 'batch_size': 16, 'weight_decay_power': 4, 'lr_val': 0.0002, 'use_embeddings': False, 'patience': 13}. Best is trial 0 with value: 10.0.
[I 2024-11-08 05:57:28,937] Trial 13 finished with value: 10.0 and parameters: {'abs_or_rel': 'abs', 'loss_type': 'H1', 'n_layers': 15, 'batch_size': 32, 'weight_decay_power': 2, 'lr_val': 0.0008, 'use_embeddings': False, 'patience': 16}. Best is trial 0 with value: 10.0.
[I 2024-11-08 05:57:47,969] Trial 14 finished with value: 10.0 and parameters: {'abs_or_rel': 'rel', 'loss_type': 'H1', 'n_layers': 11, 'batch_size': 32, 'weight_decay_power': 5, 'lr_val': 0.0003, 'use_embeddings': True, 'embed_d': 26, 'patience': 12}. Best is trial 0 with value: 10.0.
