[I 2024-11-08 14:13:55,072] Trial 41 finished with value: 10.0 and parameters: {'abs_or_rel': 'abs', 'loss_type': 'L2', 'n_layers': 12, 'batch_size': 128, 'weight_decay_power': 6, 'lr_val': 0.0008, 'use_embeddings': False, 'patience': 13}. Best is trial 1 with value: 10.0.
[I 2024-11-08 14:23:53,173] Trial 42 finished with value: 10.0 and parameters: {'abs_or_rel': 'rel', 'loss_type': 'L2', 'n_layers': 16, 'batch_size': 256, 'weight_decay_power': 7, 'lr_val': 0.0004, 'use_embeddings': True, 'embed_d': 20, 'patience': 22}. Best is trial 1 with value: 10.0.
[I 2024-11-08 14:40:22,000] Trial 43 finished with value: 10.0 and parameters: {'abs_or_rel': 'rel', 'loss_type': 'H1', 'n_layers': 8, 'batch_size': 16, 'weight_decay_power': 7, 'lr_val': 0.0005, 'use_embeddings': True, 'embed_d': 4, 'patience': 15}. Best is trial 1 with value: 10.0.
[I 2024-11-08 14:51:03,003] Trial 44 finished with value: 10.0 and parameters: {'abs_or_rel': 'rel', 'loss_type': 'L2', 'n_layers': 12, 'batch_size': 64, 'weight_decay_power': 6, 'lr_val': 0.0002, 'use_embeddings': True, 'embed_d': 11, 'patience': 22}. Best is trial 1 with value: 10.0.
[I 2024-11-08 15:02:26,785] Trial 45 finished with value: 10.0 and parameters: {'abs_or_rel': 'abs', 'loss_type': 'L2', 'n_layers': 13, 'batch_size': 64, 'weight_decay_power': 2, 'lr_val': 0.0001, 'use_embeddings': False, 'patience': 13}. Best is trial 1 with value: 10.0.
[I 2024-11-08 15:13:21,233] Trial 46 finished with value: 10.0 and parameters: {'abs_or_rel': 'abs', 'loss_type': 'H1', 'n_layers': 12, 'batch_size': 64, 'weight_decay_power': 2, 'lr_val': 8e-05, 'use_embeddings': True, 'embed_d': 25, 'patience': 9}. Best is trial 1 with value: 10.0.
[I 2024-11-08 15:41:26,172] Trial 47 finished with value: 10.0 and parameters: {'abs_or_rel': 'abs', 'loss_type': 'L2', 'n_layers': 14, 'batch_size': 16, 'weight_decay_power': 5, 'lr_val': 0.0003, 'use_embeddings': False, 'patience': 18}. Best is trial 1 with value: 10.0.
[I 2024-11-08 16:07:33,999] Trial 48 finished with value: 10.0 and parameters: {'abs_or_rel': 'rel', 'loss_type': 'L2', 'n_layers': 13, 'batch_size': 16, 'weight_decay_power': 3, 'lr_val': 0.0001, 'use_embeddings': False, 'patience': 20}. Best is trial 1 with value: 10.0.
[I 2024-11-08 16:23:57,351] Trial 49 finished with value: 10.0 and parameters: {'abs_or_rel': 'abs', 'loss_type': 'H1', 'n_layers': 13, 'batch_size': 32, 'weight_decay_power': 3, 'lr_val': 0.0002, 'use_embeddings': True, 'embed_d': 8, 'patience': 17}. Best is trial 1 with value: 10.0.
[I 2024-11-08 16:32:49,865] Trial 50 finished with value: 10.0 and parameters: {'abs_or_rel': 'rel', 'loss_type': 'H1', 'n_layers': 10, 'batch_size': 64, 'weight_decay_power': 8, 'lr_val': 0.0003, 'use_embeddings': False, 'patience': 12}. Best is trial 1 with value: 10.0.

Best value: 10.0 (params: {'abs_or_rel': 'rel', 'loss_type': 'H1', 'n_layers': 14, 'batch_size': 64, 'weight_decay_power': 5, 'lr_val': 0.0007, 'use_embeddings': True, 'embed_d': 27, 'patience': 14})
