[I 2024-11-08 06:34:51,541] Trial 16 finished with value: 10.0 and parameters: {'abs_or_rel': 'abs', 'loss_type': 'L2', 'n_layers': 11, 'batch_size': 64, 'weight_decay_power': 7, 'lr_val': 0.0004, 'use_embeddings': False, 'patience': 9}. Best is trial 0 with value: 10.0.
[I 2024-11-08 06:36:30,445] Trial 44 finished with value: 10.0 and parameters: {'abs_or_rel': 'rel', 'loss_type': 'H1', 'n_layers': 16, 'batch_size': 16, 'weight_decay_power': 2, 'lr_val': 0.0006, 'use_embeddings': False, 'patience': 20}. Best is trial 0 with value: 10.0.
[I 2024-11-08 06:37:06,402] Trial 17 finished with value: 10.0 and parameters: {'abs_or_rel': 'rel', 'loss_type': 'H1', 'n_layers': 12, 'batch_size': 64, 'weight_decay_power': 2, 'lr_val': 8e-05, 'use_embeddings': True, 'embed_d': 20, 'patience': 14}. Best is trial 0 with value: 10.0.
[I 2024-11-08 06:37:15,303] Trial 45 finished with value: 10.0 and parameters: {'abs_or_rel': 'abs', 'loss_type': 'H1', 'n_layers': 12, 'batch_size': 128, 'weight_decay_power': 4, 'lr_val': 0.0003, 'use_embeddings': False, 'patience': 20}. Best is trial 0 with value: 10.0.
[I 2024-11-08 06:37:54,982] Trial 46 finished with value: 10.0 and parameters: {'abs_or_rel': 'abs', 'loss_type': 'L2', 'n_layers': 8, 'batch_size': 64, 'weight_decay_power': 6, 'lr_val': 8e-05, 'use_embeddings': True, 'embed_d': 15, 'patience': 21}. Best is trial 0 with value: 10.0.
[I 2024-11-08 06:38:36,269] Trial 47 finished with value: 10.0 and parameters: {'abs_or_rel': 'abs', 'loss_type': 'H1', 'n_layers': 11, 'batch_size': 256, 'weight_decay_power': 8, 'lr_val': 0.0006, 'use_embeddings': True, 'embed_d': 21, 'patience': 23}. Best is trial 0 with value: 10.0.
[I 2024-11-08 06:39:20,529] Trial 4 finished with value: 10.0 and parameters: {'abs_or_rel': 'rel', 'loss_type': 'L2', 'n_layers': 11, 'batch_size': 16, 'weight_decay_power': 5, 'lr_val': 0.0001, 'use_embeddings': True, 'embed_d': 4, 'patience': 11}. Best is trial 1 with value: 10.0.
[I 2024-11-08 06:40:15,802] Trial 48 finished with value: 10.0 and parameters: {'abs_or_rel': 'rel', 'loss_type': 'H1', 'n_layers': 11, 'batch_size': 16, 'weight_decay_power': 5, 'lr_val': 8e-05, 'use_embeddings': True, 'embed_d': 6, 'patience': 22}. Best is trial 0 with value: 10.0.
[I 2024-11-08 06:41:11,993] Trial 49 finished with value: 10.0 and parameters: {'abs_or_rel': 'abs', 'loss_type': 'L2', 'n_layers': 13, 'batch_size': 64, 'weight_decay_power': 6, 'lr_val': 0.0003, 'use_embeddings': False, 'patience': 19}. Best is trial 0 with value: 10.0.

Best value: 10.0 (params: {'abs_or_rel': 'rel', 'loss_type': 'L2', 'n_layers': 10, 'batch_size': 64, 'weight_decay_power': 7, 'lr_val': 0.0004, 'use_embeddings': True, 'embed_d': 2, 'patience': 11})
[I 2024-11-08 06:43:13,417] Trial 18 finished with value: 10.0 and parameters: {'abs_or_rel': 'rel', 'loss_type': 'H1', 'n_layers': 15, 'batch_size': 16, 'weight_decay_power': 7, 'lr_val': 0.0001, 'use_embeddings': False, 'patience': 19}. Best is trial 0 with value: 10.0.
[I 2024-11-08 06:45:03,368] Trial 19 finished with value: 10.0 and parameters: {'abs_or_rel': 'abs', 'loss_type': 'L2', 'n_layers': 12, 'batch_size': 128, 'weight_decay_power': 6, 'lr_val': 0.0007, 'use_embeddings': True, 'embed_d': 19, 'patience': 21}. Best is trial 0 with value: 10.0.
[I 2024-11-08 06:46:30,299] Trial 5 finished with value: 10.0 and parameters: {'abs_or_rel': 'abs', 'loss_type': 'L2', 'n_layers': 8, 'batch_size': 64, 'weight_decay_power': 4, 'lr_val': 0.0005, 'use_embeddings': False, 'patience': 16}. Best is trial 1 with value: 10.0.
[I 2024-11-08 06:49:11,593] Trial 20 finished with value: 10.0 and parameters: {'abs_or_rel': 'abs', 'loss_type': 'H1', 'n_layers': 10, 'batch_size': 16, 'weight_decay_power': 6, 'lr_val': 0.0005, 'use_embeddings': False, 'patience': 9}. Best is trial 0 with value: 10.0.
[I 2024-11-08 06:54:53,562] Trial 21 finished with value: 10.0 and parameters: {'abs_or_rel': 'rel', 'loss_type': 'L2', 'n_layers': 14, 'batch_size': 16, 'weight_decay_power': 5, 'lr_val': 0.0008, 'use_embeddings': True, 'embed_d': 4, 'patience': 15}. Best is trial 0 with value: 10.0.
[I 2024-11-08 06:58:29,009] Trial 22 finished with value: 10.0 and parameters: {'abs_or_rel': 'abs', 'loss_type': 'L2', 'n_layers': 14, 'batch_size': 32, 'weight_decay_power': 8, 'lr_val': 0.0008, 'use_embeddings': False, 'patience': 15}. Best is trial 0 with value: 10.0.
[I 2024-11-08 07:01:50,207] Trial 23 finished with value: 10.0 and parameters: {'abs_or_rel': 'abs', 'loss_type': 'H1', 'n_layers': 13, 'batch_size': 32, 'weight_decay_power': 4, 'lr_val': 0.0006, 'use_embeddings': False, 'patience': 10}. Best is trial 0 with value: 10.0.
[I 2024-11-08 07:03:37,929] Trial 24 finished with value: 10.0 and parameters: {'abs_or_rel': 'abs', 'loss_type': 'L2', 'n_layers': 12, 'batch_size': 128, 'weight_decay_power': 8, 'lr_val': 0.0005, 'use_embeddings': True, 'embed_d': 7, 'patience': 24}. Best is trial 0 with value: 10.0.
[I 2024-11-08 07:04:51,742] Trial 25 finished with value: 10.0 and parameters: {'abs_or_rel': 'abs', 'loss_type': 'H1', 'n_layers': 8, 'batch_size': 128, 'weight_decay_power': 4, 'lr_val': 0.0008, 'use_embeddings': True, 'embed_d': 2, 'patience': 11}. Best is trial 0 with value: 10.0.
[I 2024-11-08 07:07:03,694] Trial 26 finished with value: 10.0 and parameters: {'abs_or_rel': 'rel', 'loss_type': 'L2', 'n_layers': 15, 'batch_size': 128, 'weight_decay_power': 4, 'lr_val': 0.0003, 'use_embeddings': False, 'patience': 12}. Best is trial 0 with value: 10.0.
[I 2024-11-08 07:08:25,161] Trial 27 finished with value: 10.0 and parameters: {'abs_or_rel': 'abs', 'loss_type': 'H1', 'n_layers': 9, 'batch_size': 128, 'weight_decay_power': 5, 'lr_val': 8e-05, 'use_embeddings': False, 'patience': 12}. Best is trial 0 with value: 10.0.
[I 2024-11-08 07:10:46,840] Trial 28 finished with value: 10.0 and parameters: {'abs_or_rel': 'rel', 'loss_type': 'H1', 'n_layers': 9, 'batch_size': 32, 'weight_decay_power': 2, 'lr_val': 0.0003, 'use_embeddings': False, 'patience': 16}. Best is trial 0 with value: 10.0.
[I 2024-11-08 07:11:03,006] Trial 6 finished with value: 10.0 and parameters: {'abs_or_rel': 'rel', 'loss_type': 'H1', 'n_layers': 12, 'batch_size': 16, 'weight_decay_power': 5, 'lr_val': 0.0008, 'use_embeddings': True, 'embed_d': 30, 'patience': 12}. Best is trial 1 with value: 10.0.
[I 2024-11-08 07:13:29,533] Trial 29 finished with value: 10.0 and parameters: {'abs_or_rel': 'abs', 'loss_type': 'L2', 'n_layers': 15, 'batch_size': 64, 'weight_decay_power': 2, 'lr_val': 0.0001, 'use_embeddings': True, 'embed_d': 5, 'patience': 19}. Best is trial 0 with value: 10.0.
[I 2024-11-08 07:16:01,837] Trial 30 finished with value: 10.0 and parameters: {'abs_or_rel': 'rel', 'loss_type': 'H1', 'n_layers': 14, 'batch_size': 64, 'weight_decay_power': 2, 'lr_val': 8e-05, 'use_embeddings': False, 'patience': 20}. Best is trial 0 with value: 10.0.
[I 2024-11-08 07:17:57,858] Trial 31 finished with value: 10.0 and parameters: {'abs_or_rel': 'rel', 'loss_type': 'H1', 'n_layers': 15, 'batch_size': 256, 'weight_decay_power': 6, 'lr_val': 0.0006, 'use_embeddings': False, 'patience': 12}. Best is trial 0 with value: 10.0.
[I 2024-11-08 07:18:59,047] Trial 7 finished with value: 10.0 and parameters: {'abs_or_rel': 'abs', 'loss_type': 'L2', 'n_layers': 13, 'batch_size': 256, 'weight_decay_power': 5, 'lr_val': 0.0007, 'use_embeddings': False, 'patience': 13}. Best is trial 1 with value: 10.0.
[I 2024-11-08 07:22:05,287] Trial 32 finished with value: 10.0 and parameters: {'abs_or_rel': 'abs', 'loss_type': 'H1', 'n_layers': 16, 'batch_size': 32, 'weight_decay_power': 5, 'lr_val': 0.0004, 'use_embeddings': True, 'embed_d': 19, 'patience': 21}. Best is trial 0 with value: 10.0.
[I 2024-11-08 07:26:14,157] Trial 33 finished with value: 10.0 and parameters: {'abs_or_rel': 'rel', 'loss_type': 'H1', 'n_layers': 10, 'batch_size': 16, 'weight_decay_power': 7, 'lr_val': 8e-05, 'use_embeddings': True, 'embed_d': 10, 'patience': 19}. Best is trial 0 with value: 10.0.
[I 2024-11-08 07:27:44,504] Trial 34 finished with value: 10.0 and parameters: {'abs_or_rel': 'abs', 'loss_type': 'H1', 'n_layers': 8, 'batch_size': 64, 'weight_decay_power': 7, 'lr_val': 0.0003, 'use_embeddings': True, 'embed_d': 2, 'patience': 22}. Best is trial 0 with value: 10.0.
[I 2024-11-08 07:28:41,064] Trial 8 finished with value: 10.0 and parameters: {'abs_or_rel': 'abs', 'loss_type': 'H1', 'n_layers': 11, 'batch_size': 64, 'weight_decay_power': 3, 'lr_val': 0.0004, 'use_embeddings': False, 'patience': 19}. Best is trial 1 with value: 10.0.
[I 2024-11-08 07:31:04,841] Trial 35 finished with value: 10.0 and parameters: {'abs_or_rel': 'rel', 'loss_type': 'H1', 'n_layers': 13, 'batch_size': 32, 'weight_decay_power': 4, 'lr_val': 8e-05, 'use_embeddings': False, 'patience': 12}. Best is trial 0 with value: 10.0.
[I 2024-11-08 07:32:13,205] Trial 36 finished with value: 10.0 and parameters: {'abs_or_rel': 'abs', 'loss_type': 'L2', 'n_layers': 8, 'batch_size': 256, 'weight_decay_power': 3, 'lr_val': 0.0007, 'use_embeddings': True, 'embed_d': 27, 'patience': 12}. Best is trial 0 with value: 10.0.
[I 2024-11-08 07:34:10,828] Trial 37 finished with value: 10.0 and parameters: {'abs_or_rel': 'abs', 'loss_type': 'L2', 'n_layers': 15, 'batch_size': 256, 'weight_decay_power': 6, 'lr_val': 0.0002, 'use_embeddings': True, 'embed_d': 8, 'patience': 16}. Best is trial 0 with value: 10.0.
[I 2024-11-08 07:38:19,318] Trial 38 finished with value: 10.0 and parameters: {'abs_or_rel': 'rel', 'loss_type': 'L2', 'n_layers': 10, 'batch_size': 16, 'weight_decay_power': 8, 'lr_val': 0.0005, 'use_embeddings': True, 'embed_d': 11, 'patience': 23}. Best is trial 0 with value: 10.0.
[I 2024-11-08 07:39:55,497] Trial 9 finished with value: 10.0 and parameters: {'abs_or_rel': 'abs', 'loss_type': 'L2', 'n_layers': 16, 'batch_size': 128, 'weight_decay_power': 3, 'lr_val': 0.0007, 'use_embeddings': True, 'embed_d': 11, 'patience': 9}. Best is trial 1 with value: 10.0.
[I 2024-11-08 07:40:55,884] Trial 39 finished with value: 10.0 and parameters: {'abs_or_rel': 'abs', 'loss_type': 'L2', 'n_layers': 14, 'batch_size': 64, 'weight_decay_power': 4, 'lr_val': 0.0005, 'use_embeddings': True, 'embed_d': 24, 'patience': 13}. Best is trial 0 with value: 10.0.
[I 2024-11-08 07:42:41,661] Trial 40 finished with value: 10.0 and parameters: {'abs_or_rel': 'rel', 'loss_type': 'L2', 'n_layers': 13, 'batch_size': 256, 'weight_decay_power': 7, 'lr_val': 0.0004, 'use_embeddings': True, 'embed_d': 26, 'patience': 24}. Best is trial 0 with value: 10.0.
[I 2024-11-08 07:44:30,307] Trial 41 finished with value: 10.0 and parameters: {'abs_or_rel': 'rel', 'loss_type': 'H1', 'n_layers': 12, 'batch_size': 128, 'weight_decay_power': 7, 'lr_val': 0.0008, 'use_embeddings': True, 'embed_d': 9, 'patience': 17}. Best is trial 0 with value: 10.0.
[I 2024-11-08 07:46:26,081] Trial 42 finished with value: 10.0 and parameters: {'abs_or_rel': 'abs', 'loss_type': 'L2', 'n_layers': 13, 'batch_size': 128, 'weight_decay_power': 7, 'lr_val': 0.0008, 'use_embeddings': True, 'embed_d': 3, 'patience': 18}. Best is trial 0 with value: 10.0.
[I 2024-11-08 07:50:59,862] Trial 43 finished with value: 10.0 and parameters: {'abs_or_rel': 'rel', 'loss_type': 'H1', 'n_layers': 11, 'batch_size': 16, 'weight_decay_power': 4, 'lr_val': 0.0007, 'use_embeddings': True, 'embed_d': 14, 'patience': 8}. Best is trial 0 with value: 10.0.
[I 2024-11-08 07:52:33,195] Trial 44 finished with value: 10.0 and parameters: {'abs_or_rel': 'rel', 'loss_type': 'L2', 'n_layers': 10, 'batch_size': 128, 'weight_decay_power': 4, 'lr_val': 0.0001, 'use_embeddings': True, 'embed_d': 24, 'patience': 13}. Best is trial 0 with value: 10.0.
[I 2024-11-08 07:55:31,132] Trial 45 finished with value: 10.0 and parameters: {'abs_or_rel': 'rel', 'loss_type': 'L2', 'n_layers': 16, 'batch_size': 64, 'weight_decay_power': 6, 'lr_val': 0.0002, 'use_embeddings': True, 'embed_d': 32, 'patience': 21}. Best is trial 0 with value: 10.0.
[I 2024-11-08 07:56:46,613] Trial 46 finished with value: 10.0 and parameters: {'abs_or_rel': 'abs', 'loss_type': 'L2', 'n_layers': 8, 'batch_size': 128, 'weight_decay_power': 7, 'lr_val': 0.0008, 'use_embeddings': True, 'embed_d': 15, 'patience': 23}. Best is trial 0 with value: 10.0.
[I 2024-11-08 07:57:43,088] Trial 10 finished with value: 10.0 and parameters: {'abs_or_rel': 'rel', 'loss_type': 'L2', 'n_layers': 14, 'batch_size': 32, 'weight_decay_power': 5, 'lr_val': 0.0005, 'use_embeddings': True, 'embed_d': 28, 'patience': 18}. Best is trial 1 with value: 10.0.
[I 2024-11-08 08:03:19,023] Trial 47 finished with value: 10.0 and parameters: {'abs_or_rel': 'rel', 'loss_type': 'L2', 'n_layers': 16, 'batch_size': 16, 'weight_decay_power': 7, 'lr_val': 0.0001, 'use_embeddings': True, 'embed_d': 27, 'patience': 20}. Best is trial 0 with value: 10.0.
[I 2024-11-08 08:05:09,641] Trial 48 finished with value: 10.0 and parameters: {'abs_or_rel': 'rel', 'loss_type': 'H1', 'n_layers': 10, 'batch_size': 64, 'weight_decay_power': 2, 'lr_val': 0.0002, 'use_embeddings': False, 'patience': 10}. Best is trial 0 with value: 10.0.
[I 2024-11-08 08:05:39,053] Trial 11 finished with value: 10.0 and parameters: {'abs_or_rel': 'abs', 'loss_type': 'H1', 'n_layers': 13, 'batch_size': 256, 'weight_decay_power': 3, 'lr_val': 0.0003, 'use_embeddings': False, 'patience': 24}. Best is trial 1 with value: 10.0.
[I 2024-11-08 08:06:39,714] Trial 49 finished with value: 10.0 and parameters: {'abs_or_rel': 'abs', 'loss_type': 'L2', 'n_layers': 10, 'batch_size': 128, 'weight_decay_power': 4, 'lr_val': 0.0004, 'use_embeddings': False, 'patience': 8}. Best is trial 0 with value: 10.0.

Best value: 10.0 (params: {'abs_or_rel': 'rel', 'loss_type': 'H1', 'n_layers': 8, 'batch_size': 32, 'weight_decay_power': 6, 'lr_val': 0.0007, 'use_embeddings': False, 'patience': 24})
[I 2024-11-08 08:16:03,625] Trial 12 finished with value: 10.0 and parameters: {'abs_or_rel': 'abs', 'loss_type': 'L2', 'n_layers': 15, 'batch_size': 128, 'weight_decay_power': 5, 'lr_val': 0.0005, 'use_embeddings': False, 'patience': 22}. Best is trial 1 with value: 10.0.
[I 2024-11-08 08:36:16,046] Trial 13 finished with value: 10.0 and parameters: {'abs_or_rel': 'abs', 'loss_type': 'L2', 'n_layers': 16, 'batch_size': 32, 'weight_decay_power': 2, 'lr_val': 0.0006, 'use_embeddings': True, 'embed_d': 30, 'patience': 10}. Best is trial 1 with value: 10.0.
[I 2024-11-08 08:47:43,602] Trial 14 finished with value: 10.0 and parameters: {'abs_or_rel': 'rel', 'loss_type': 'L2', 'n_layers': 9, 'batch_size': 32, 'weight_decay_power': 4, 'lr_val': 0.0002, 'use_embeddings': False, 'patience': 16}. Best is trial 1 with value: 10.0.
[I 2024-11-08 08:53:30,572] Trial 15 finished with value: 10.0 and parameters: {'abs_or_rel': 'abs', 'loss_type': 'H1', 'n_layers': 8, 'batch_size': 128, 'weight_decay_power': 3, 'lr_val': 8e-05, 'use_embeddings': False, 'patience': 21}. Best is trial 1 with value: 10.0.
[I 2024-11-08 09:01:07,104] Trial 16 finished with value: 10.0 and parameters: {'abs_or_rel': 'rel', 'loss_type': 'H1', 'n_layers': 12, 'batch_size': 256, 'weight_decay_power': 3, 'lr_val': 0.0006, 'use_embeddings': True, 'embed_d': 15, 'patience': 20}. Best is trial 1 with value: 10.0.
[I 2024-11-08 09:10:02,591] Trial 17 finished with value: 10.0 and parameters: {'abs_or_rel': 'abs', 'loss_type': 'L2', 'n_layers': 10, 'batch_size': 64, 'weight_decay_power': 3, 'lr_val': 0.0003, 'use_embeddings': False, 'patience': 21}. Best is trial 1 with value: 10.0.
[I 2024-11-08 09:15:48,456] Trial 18 finished with value: 10.0 and parameters: {'abs_or_rel': 'abs', 'loss_type': 'H1', 'n_layers': 8, 'batch_size': 128, 'weight_decay_power': 8, 'lr_val': 0.0002, 'use_embeddings': False, 'patience': 13}. Best is trial 1 with value: 10.0.
[I 2024-11-08 09:43:55,339] Trial 19 finished with value: 10.0 and parameters: {'abs_or_rel': 'rel', 'loss_type': 'H1', 'n_layers': 14, 'batch_size': 16, 'weight_decay_power': 7, 'lr_val': 0.0001, 'use_embeddings': False, 'patience': 22}. Best is trial 1 with value: 10.0.
[I 2024-11-08 09:51:56,677] Trial 20 finished with value: 10.0 and parameters: {'abs_or_rel': 'rel', 'loss_type': 'H1', 'n_layers': 9, 'batch_size': 64, 'weight_decay_power': 6, 'lr_val': 0.0003, 'use_embeddings': False, 'patience': 22}. Best is trial 1 with value: 10.0.
[I 2024-11-08 10:20:12,022] Trial 21 finished with value: 10.0 and parameters: {'abs_or_rel': 'abs', 'loss_type': 'H1', 'n_layers': 14, 'batch_size': 16, 'weight_decay_power': 6, 'lr_val': 0.0003, 'use_embeddings': True, 'embed_d': 15, 'patience': 18}. Best is trial 1 with value: 10.0.
[I 2024-11-08 10:27:41,535] Trial 22 finished with value: 10.0 and parameters: {'abs_or_rel': 'abs', 'loss_type': 'H1', 'n_layers': 10, 'batch_size': 128, 'weight_decay_power': 7, 'lr_val': 8e-05, 'use_embeddings': True, 'embed_d': 31, 'patience': 13}. Best is trial 1 with value: 10.0.
[I 2024-11-08 10:43:59,991] Trial 23 finished with value: 10.0 and parameters: {'abs_or_rel': 'abs', 'loss_type': 'L2', 'n_layers': 13, 'batch_size': 32, 'weight_decay_power': 3, 'lr_val': 0.0008, 'use_embeddings': False, 'patience': 10}. Best is trial 1 with value: 10.0.
[I 2024-11-08 10:53:23,971] Trial 24 finished with value: 10.0 and parameters: {'abs_or_rel': 'abs', 'loss_type': 'L2', 'n_layers': 13, 'batch_size': 128, 'weight_decay_power': 7, 'lr_val': 0.0001, 'use_embeddings': True, 'embed_d': 25, 'patience': 10}. Best is trial 1 with value: 10.0.
[I 2024-11-08 11:02:15,091] Trial 25 finished with value: 10.0 and parameters: {'abs_or_rel': 'abs', 'loss_type': 'L2', 'n_layers': 10, 'batch_size': 64, 'weight_decay_power': 4, 'lr_val': 0.0004, 'use_embeddings': False, 'patience': 23}. Best is trial 1 with value: 10.0.
[I 2024-11-08 11:20:56,589] Trial 26 finished with value: 10.0 and parameters: {'abs_or_rel': 'abs', 'loss_type': 'L2', 'n_layers': 15, 'batch_size': 32, 'weight_decay_power': 3, 'lr_val': 0.0008, 'use_embeddings': False, 'patience': 8}. Best is trial 1 with value: 10.0.
[I 2024-11-08 11:30:43,223] Trial 27 finished with value: 10.0 and parameters: {'abs_or_rel': 'abs', 'loss_type': 'H1', 'n_layers': 16, 'batch_size': 256, 'weight_decay_power': 8, 'lr_val': 0.0003, 'use_embeddings': True, 'embed_d': 6, 'patience': 15}. Best is trial 1 with value: 10.0.
[I 2024-11-08 11:39:51,517] Trial 28 finished with value: 10.0 and parameters: {'abs_or_rel': 'abs', 'loss_type': 'H1', 'n_layers': 15, 'batch_size': 256, 'weight_decay_power': 6, 'lr_val': 0.0008, 'use_embeddings': True, 'embed_d': 1, 'patience': 19}. Best is trial 1 with value: 10.0.
[I 2024-11-08 11:54:55,359] Trial 29 finished with value: 10.0 and parameters: {'abs_or_rel': 'rel', 'loss_type': 'L2', 'n_layers': 12, 'batch_size': 32, 'weight_decay_power': 2, 'lr_val': 0.0006, 'use_embeddings': False, 'patience': 16}. Best is trial 1 with value: 10.0.
[I 2024-11-08 12:11:11,878] Trial 30 finished with value: 10.0 and parameters: {'abs_or_rel': 'rel', 'loss_type': 'L2', 'n_layers': 13, 'batch_size': 32, 'weight_decay_power': 3, 'lr_val': 0.0008, 'use_embeddings': False, 'patience': 18}. Best is trial 1 with value: 10.0.
[I 2024-11-08 12:17:36,561] Trial 31 finished with value: 10.0 and parameters: {'abs_or_rel': 'rel', 'loss_type': 'L2', 'n_layers': 9, 'batch_size': 128, 'weight_decay_power': 8, 'lr_val': 0.0003, 'use_embeddings': False, 'patience': 16}. Best is trial 1 with value: 10.0.
[I 2024-11-08 12:25:33,555] Trial 32 finished with value: 10.0 and parameters: {'abs_or_rel': 'rel', 'loss_type': 'L2', 'n_layers': 13, 'batch_size': 256, 'weight_decay_power': 4, 'lr_val': 0.0008, 'use_embeddings': False, 'patience': 18}. Best is trial 1 with value: 10.0.
[I 2024-11-08 12:54:00,985] Trial 33 finished with value: 10.0 and parameters: {'abs_or_rel': 'rel', 'loss_type': 'L2', 'n_layers': 14, 'batch_size': 16, 'weight_decay_power': 2, 'lr_val': 0.0004, 'use_embeddings': True, 'embed_d': 30, 'patience': 16}. Best is trial 1 with value: 10.0.
[I 2024-11-08 13:04:08,815] Trial 34 finished with value: 10.0 and parameters: {'abs_or_rel': 'abs', 'loss_type': 'H1', 'n_layers': 16, 'batch_size': 256, 'weight_decay_power': 6, 'lr_val': 0.0004, 'use_embeddings': True, 'embed_d': 29, 'patience': 9}. Best is trial 1 with value: 10.0.
[I 2024-11-08 13:10:19,810] Trial 35 finished with value: 10.0 and parameters: {'abs_or_rel': 'abs', 'loss_type': 'L2', 'n_layers': 8, 'batch_size': 128, 'weight_decay_power': 7, 'lr_val': 0.0008, 'use_embeddings': True, 'embed_d': 31, 'patience': 22}. Best is trial 1 with value: 10.0.
[I 2024-11-08 13:21:25,861] Trial 36 finished with value: 10.0 and parameters: {'abs_or_rel': 'abs', 'loss_type': 'L2', 'n_layers': 16, 'batch_size': 128, 'weight_decay_power': 4, 'lr_val': 0.0002, 'use_embeddings': False, 'patience': 13}. Best is trial 1 with value: 10.0.
[I 2024-11-08 13:31:13,239] Trial 37 finished with value: 10.0 and parameters: {'abs_or_rel': 'abs', 'loss_type': 'H1', 'n_layers': 11, 'batch_size': 64, 'weight_decay_power': 7, 'lr_val': 0.0008, 'use_embeddings': True, 'embed_d': 7, 'patience': 9}. Best is trial 1 with value: 10.0.
[I 2024-11-08 13:40:38,367] Trial 38 finished with value: 10.0 and parameters: {'abs_or_rel': 'rel', 'loss_type': 'H1', 'n_layers': 13, 'batch_size': 128, 'weight_decay_power': 6, 'lr_val': 0.0008, 'use_embeddings': True, 'embed_d': 23, 'patience': 11}. Best is trial 1 with value: 10.0.
[I 2024-11-08 13:54:38,474] Trial 39 finished with value: 10.0 and parameters: {'abs_or_rel': 'rel', 'loss_type': 'L2', 'n_layers': 11, 'batch_size': 32, 'weight_decay_power': 2, 'lr_val': 0.0002, 'use_embeddings': True, 'embed_d': 11, 'patience': 12}. Best is trial 1 with value: 10.0.
[I 2024-11-08 14:05:28,996] Trial 40 finished with value: 10.0 and parameters: {'abs_or_rel': 'rel', 'loss_type': 'L2', 'n_layers': 15, 'batch_size': 128, 'weight_decay_power': 3, 'lr_val': 0.0008, 'use_embeddings': True, 'embed_d': 31, 'patience': 14}. Best is trial 1 with value: 10.0.
